[
  {
    "v": 2,
    "id": "CS01",
    "m": "H",
    "n": 2000,
    "u": 286000,
    "t": 0,
    "st": 1,
    "fl": 1,
    "cam": 1,
    "sd": 23842,
    "dp": 0
  },
  {
    "v": 2,
    "id": "CS01",
    "m": "E",
    "n": 2001,
    "u": 286200,
    "t": 0,
    "st": 1,
    "fl": 1,
    "t1": 2465,
    "rh": 5210,
    "p1": 100843,
    "gr": 128400,
    "t2": 2459,
    "p2": 100827
  },
  {
    "v": 2,
    "id": "CS01",
    "m": "O",
    "n": 2002,
    "u": 286400,
    "t": 0,
    "st": 1,
    "fl": 1,
    "lx": 341,
    "uvr": 1830,
    "uvm": 1474
  },
  {
    "v": 2,
    "id": "CS01",
    "m": "I",
    "n": 2003,
    "u": 286600,
    "t": 0,
    "st": 1,
    "fl": 1,
    "ax": -23,
    "ay": 14,
    "az": 1008,
    "gx": 120,
    "gy": -75,
    "gz": 18
  },
  {
    "v": 2,
    "id": "CS01",
    "m": "G",
    "n": 2004,
    "u": 286800,
    "t": 1790263810,
    "st": 4,
    "fl": 0,
    "la": -120463700,
    "lo": -770427900,
    "al": 81240,
    "sp": 735,
    "hd": 18450,
    "fx": 3,
    "sa": 11
  }
]
